transaction_id,customer_id,branch_name,transaction_type,waiting_time,processing_time,transaction_time,date,sentiment,sentiment_score,review_text,bhs
BPI0821B001,B001,BPI Rockwell Branch,deposit,6,3,9,2025-08-21,positive,5.0,Quick and professional service. Highly recommended branch.,
BPI0821N001,N001,BPI The Rise Branch,deposit,3,4,7,2025-08-21,positive,5.0,Staff explained everything clearly. Great customer service!,
BPI0821B001,B001,BPI F. Ortigas Jr Road Branch,encashment,7,4,11,2025-08-21,positive,3.71,No hassle transaction. Staff was accommodating.,
BPI0821N001,N001,BPI The Residences At Greenbelt Branch,deposit,3,3,6,2025-08-21,positive,3.65,Smooth transaction from start to finish. Well done!,
BPI0821B001,B001,BPI Malabon Gov Pascual,withdrawal,2,3,5,2025-08-21,positive,4.75,Staff was patient in explaining loan details. Great service!,
BPI0821N002,N002,BPI Dr. A. Santos Avenue BF Branch,encashment,7,4,11,2025-08-21,positive,3.39,Security measures are top-notch. Feel safe banking here.,
BPI0821N001,N001,BPI Katipunan Loyola Heights Branch,deposit,5,5,10,2025-08-21,positive,3.72,Friendly faces everywhere,
BPI0821B001,B001,BPI Rufino Tower Branch,encashment,8,5,13,2025-08-21,positive,3.73,Insurance products are reasonably priced and comprehensive.,
BPI0821N001,N001,BPI Buendia Malugay Branch,encashment,4,5,9,2025-08-21,positive,3.52,ATM worked perfectly fine,
BPI0821N002,N002,BPI Roces,withdrawal,5,3,8,2025-08-21,positive,4.57,"Fast transaction, friendly staff. Will come back again.",
BPI0821N002,N002,BPI Alabang Insular Life Branch,deposit,5,5,10,2025-08-21,positive,4.09,"Clean facility, organized queue system. Very satisfied.",
BPI0821N001,N001,BPI Forbes Park Branch,encashment,5,5,10,2025-08-21,positive,4.05,Online banking platform is user-friendly and secure.,
BPI0821N004,N004,BPI Blue Ridge Boni Serrano Branch,customer service,8,10,18,2025-08-21,positive,3.23,Branch manager personally handled my complaint. Excellent!,
BPI0821N001,N001,BPI Gateway,deposit,3,6,9,2025-08-21,positive,3.95,Corporate banking team understands our business needs perfectly.,
BPI0821B001,B001,BPI Marikina Gil Fernando Branch,account service,15,11,26,2025-08-21,negative,1.31,Credit score monitoring service has outdated information.,
BPI0821N002,N002,BPI Tayuman Branch,withdrawal,4,2,6,2025-08-21,positive,4.52,Best bank in the area. Never had any issues with their service.,
BPI0821N001,N001,BPI Quezon Avenue Kanlaon Branch,withdrawal,3,3,6,2025-08-21,positive,4.71,Quick and professional service. Highly recommended branch.,
BPI0821B001,B001,BPI Ayala East Branch,deposit,5,5,10,2025-08-21,positive,3.77,Quick response to account security concerns. Very professional.,
